{
  "id": "sa-generative-ai-guidelines-gov-2024",
  "title": "SDAIA Generative AI Guidelines for Government",
  "title_ar": null,
  "official_title": "Generative AI Guidelines for Government Employees",
  "official_title_ar": null,
  "jurisdiction": "SA",
  "instrument_class": "guideline",
  "binding_status": "non_binding",
  "lifecycle": "in_force",
  "themes": ["technology_digital.ai_emerging_tech", "technology_digital.digital_government"],
  "issuing_authority": "sa-sdaia",
  "language_of_official_text": "both",
  "date_issued": "2024-01-01",
  "date_effective": null,
  "compliance_deadline": null,
  "gazette": null,
  "citation": "SDAIA, Generative AI Guidelines for Government Employees, January 2024",
  "summary": "Guidance for Saudi government entities and employees on adopting and using generative AI systems. It covers responsible use scenarios, challenges and ethical considerations, and practical controls, and was published alongside a parallel version for the general public.",
  "summary_ar": null,
  "impact_note": "Government entities and their suppliers should treat these guidelines as the expected baseline for any generative AI use in the Saudi public sector, including disclosure of AI generated content, human review of outputs, and care with official or personal data in prompts. Vendors selling generative AI into government should align their offerings and contracts with the guidelines now, since they signal the direction of future binding controls and tie back to the AI Ethics Principles risk tiers.",
  "impact_note_ar": null,
  "obligations": [],
  "applicability": {
    "entity_types": ["government entities", "government employees", "suppliers to government"],
    "sectors": ["public sector"],
    "extraterritorial": false,
    "penalties": null,
    "grace_period": null
  },
  "relationships": [{ "type": "references", "target_id": "sa-ai-ethics-principles-2023" }],
  "source_url": "https://regulations.ai/regulations/RAI-SA-NA-GAGGSXX-2024",
  "source_confidence": "secondary",
  "last_verified": "2026-06-11",
  "tags": ["generative AI", "public sector", "SDAIA"],
  "notes": "Exact publication day in January 2024 needs confirmation; replace the source link with the SDAIA document. The parallel public version should be added as its own record."
}
