{
  "id": "sa-ai-ethics-principles-2023",
  "title": "SDAIA AI Ethics Principles",
  "title_ar": "مبادئ أخلاقيات الذكاء الاصطناعي",
  "official_title": "AI Ethics Principles, version 2",
  "official_title_ar": null,
  "jurisdiction": "SA",
  "instrument_class": "framework",
  "binding_status": "non_binding",
  "lifecycle": "in_force",
  "themes": ["ai_emerging_tech.ai_governance_ethics"],
  "issuing_authority": "sa-sdaia",
  "language_of_official_text": "both",
  "date_issued": "2023-09-01",
  "date_effective": null,
  "compliance_deadline": null,
  "gazette": null,
  "citation": "SDAIA, AI Ethics Principles, version 2, September 2023",
  "summary": "SDAIA's national framework for ethical AI across the system lifecycle. It sets seven core principles, a four tier risk classification for AI systems, and roles and responsibilities for developers and deployers, with SDAIA as the supervising authority.",
  "summary_ar": null,
  "impact_note": "Although non binding, this is the reference point Saudi regulators and government buyers use when assessing AI systems, and it aligns deliberately with the PDPL on personal data questions. Organisations developing or deploying AI in the Kingdom should map their systems to the four risk tiers, document conformity with the seven principles, and expect the framework's expectations to surface in procurement requirements and any future binding AI rules.",
  "impact_note_ar": null,
  "obligations": [],
  "applicability": {
    "entity_types": ["AI developers", "AI deployers", "government entities"],
    "sectors": ["all sectors"],
    "extraterritorial": false,
    "penalties": null,
    "grace_period": null
  },
  "relationships": [{ "type": "references", "target_id": "sa-pdpl-2021" }],
  "source_url": "https://www.whitecase.com/insight-our-thinking/ai-watch-global-regulatory-tracker-saudi-arabia",
  "source_confidence": "secondary",
  "last_verified": "2026-06-11",
  "tags": ["AI ethics", "risk classification", "SDAIA"],
  "notes": "Version 2 issued September 2023; the exact publication day needs confirmation and the source link should be replaced with the SDAIA document. Version 1 of September 2022 should be added as a separate record with a supersedes relationship from this one."
}
