{
  "id": "sa-pdpl-amendment-2023",
  "title": "2023 amendments to the Saudi Personal Data Protection Law",
  "title_ar": "تعديلات نظام حماية البيانات الشخصية لعام 2023",
  "official_title": "Royal Decree No. M/148 of 5/9/1444H amending the Personal Data Protection Law",
  "official_title_ar": "المرسوم الملكي رقم م/148 وتاريخ 5/9/1444هـ بتعديل نظام حماية البيانات الشخصية",
  "jurisdiction": "SA",
  "instrument_class": "decree",
  "binding_status": "binding",
  "lifecycle": "in_force",
  "themes": ["technology_digital.data_protection_privacy"],
  "issuing_authority": "sa-king",
  "language_of_official_text": "ar",
  "english_text_unofficial": true,
  "date_issued": "2023-03-27",
  "date_effective": "2023-09-14",
  "compliance_deadline": null,
  "gazette": { "name": "Umm Al Qura", "number": null, "issue_date": "2023-04-04" },
  "citation": "Royal Decree No. M/148 of 5/9/1444H (27 March 2023) amending the Personal Data Protection Law",
  "summary": "A substantive amendment package adopted before the PDPL entered into force. It introduced legitimate interest as a lawful basis for non sensitive data, replaced the restrictive transfer regime with a conditions based one, and removed the controller registration fee mechanism, aligning the law more closely with international practice.",
  "summary_ar": null,
  "impact_note": "The amendments materially lowered friction for businesses ahead of enforcement. Legitimate interest became available as a lawful basis for processing non sensitive personal data, and cross border transfers moved from a default prohibition to a framework of conditions and safeguards elaborated by the transfer regulations. Entities that designed compliance programmes against the original 2021 text should reassess their lawful basis mapping and transfer mechanics against the amended text, which is the version now in force.",
  "impact_note_ar": null,
  "obligations": [],
  "applicability": {
    "entity_types": ["private companies", "public entities", "foreign entities processing data of Saudi residents"],
    "sectors": ["all sectors"],
    "extraterritorial": true,
    "penalties": null,
    "grace_period": null
  },
  "relationships": [{ "type": "amends", "target_id": "sa-pdpl-2021" }],
  "source_url": "https://www.quinnemanuel.com/the-firm/news-events/recent-amendments-to-the-saudi-arabia-personal-data-protection-law/",
  "source_confidence": "secondary",
  "last_verified": "2026-06-11",
  "tags": ["PDPL", "legitimate interest", "cross border transfers"],
  "notes": "Replace the source link with the gazette publication of 4 April 2023 and confirm the issue number."
}
