{
  "id": "ae-ai-charter-2024",
  "title": "UAE Charter for the Development and Use of Artificial Intelligence",
  "title_ar": "ميثاق الإمارات لتطوير واستخدام الذكاء الاصطناعي",
  "official_title": "UAE Charter for the Development and Use of Artificial Intelligence",
  "official_title_ar": "ميثاق الإمارات لتطوير واستخدام الذكاء الاصطناعي",
  "jurisdiction": "AE",
  "instrument_class": "policy",
  "binding_status": "non_binding",
  "lifecycle": "in_force",
  "themes": ["technology_digital.ai_emerging_tech"],
  "issuing_authority": "ae-ai-office",
  "language_of_official_text": "both",
  "date_issued": "2024-07-01",
  "date_effective": null,
  "compliance_deadline": null,
  "gazette": null,
  "citation": "UAE Charter for the Development and Use of Artificial Intelligence, 2024",
  "summary": "A national charter of twelve principles for AI development and use in the UAE, covering human oversight, safety, algorithmic bias, privacy, transparency, and accountability. It frames the UAE's ambition to be a global AI hub while committing to responsible use.",
  "summary_ar": null,
  "impact_note": "The charter is the clearest statement of how the UAE expects AI to be governed ahead of any binding federal AI law. Companies building or deploying AI in the UAE should align governance documentation with the twelve principles, particularly human oversight, bias mitigation, and privacy commitments that connect to the federal PDPL. Treat it as the benchmark regulators and government partners will reference in procurement and future rulemaking.",
  "impact_note_ar": null,
  "obligations": [],
  "applicability": {
    "entity_types": ["AI developers", "AI deployers", "government entities"],
    "sectors": ["all sectors"],
    "extraterritorial": false,
    "penalties": null,
    "grace_period": null
  },
  "relationships": [{ "type": "references", "target_id": "ae-pdpl-2021" }],
  "source_url": "https://ai.gov.ae",
  "source_confidence": "pending_verification",
  "last_verified": "2026-06-11",
  "tags": ["AI charter", "responsible AI"],
  "notes": "Issue date approximated to July 2024 and issuing body recorded as the AI Office; confirm the exact launch date, the formal issuing authority, and a direct link to the charter text before publishing."
}
